{
  "$schema": "https://json-schema.org/draft/2020-12/schema",
  "$id": "https://mnx-lab.totai.uk/schemas/scenario-meta.schema.json/v1",
  "title": "MNX Lab scenario metadata (meta.json)",
  "description": "Sidecar metadata for one scenario in the corpus. Identity (id, category) is derived from the folder path and deliberately NOT stored here. See roadmap/complete/lab-04-scenario-library.md.",
  "type": "object",
  "properties": {
    "title": {
      "type": "string",
      "minLength": 1
    },
    "description": {
      "type": "string",
      "minLength": 1
    },
    "bars": {
      "type": "integer",
      "minimum": 1
    },
    "tags": {
      "type": "array",
      "items": {
        "type": "string",
        "pattern": "^[a-z0-9:-]+$"
      },
      "uniqueItems": true
    },
    "specRefs": {
      "type": "array",
      "items": {
        "type": "string",
        "format": "uri"
      },
      "description": "Pointers into the MNX spec (mnx-reference/objects/... pages)."
    },
    "coversDefs": {
      "type": "array",
      "items": {
        "type": "string"
      },
      "uniqueItems": true,
      "description": "Schema $defs this scenario exercises \u2014 drives the coverage report."
    },
    "origin": {
      "enum": [
        "mirrored",
        "local"
      ],
      "description": "Who writes this scenario. \"mirrored\" = generated from the pinned spec by sync:spec, hand-edit forbidden (sync owns the whole scenarios/spec/ tree); \"local\" = ours. One corpus format, two axes \u2014 see roadmap/complete/lab-structure-lab.md."
    },
    "schema": {
      "enum": [
        "published",
        "proposed"
      ],
      "description": "Which MNX schema `expect.standard` is judged against. Default \"published\" \u2014 the vendored spec release. \"proposed\" opts into spec/mnx-schema.proposed.json, a spec change drafted in our fork but not adopted by the CG; use it so a proposal can be proved against the corpus instead of only described. See docs/mnx-spec-submodule.md."
    },
    "proposal": {
      "type": "string",
      "pattern": "^[a-z0-9][a-z0-9-]*$",
      "description": "Required iff schema is \"proposed\": the proposal topic this scenario is evidence for; spec/proposals/<topic>/ must exist. No proposal scenarios loose in lab/ with their rationale only in a roadmap doc."
    },
    "expect": {
      "type": "object",
      "properties": {
        "standard": {
          "enum": [
            "valid",
            "invalid"
          ]
        },
        "extension": {
          "enum": [
            "valid",
            "invalid",
            "n/a"
          ],
          "description": "Verdict against the _x.mnxLab extension schema; n/a when the document carries no _x.mnxLab."
        },
        "errors": {
          "type": "array",
          "items": {
            "type": "string",
            "minLength": 1
          },
          "description": "Required iff any verdict is 'invalid': fragments that must each match at least one actual validation error."
        }
      },
      "required": [
        "standard",
        "extension"
      ],
      "additionalProperties": false
    },
    "requires": {
      "type": "array",
      "items": {
        "type": "string"
      },
      "uniqueItems": true,
      "description": "Renderer capabilities exercised (free-form for now)."
    },
    "idRefs": {
      "type": "boolean",
      "description": "Does the scenario exercise id-based cross-referencing (ties, slurs, technique targets)?"
    },
    "source": {
      "type": "string",
      "pattern": "^(hand-written|spec-example|llm|converter:.+)$"
    },
    "status": {
      "enum": [
        "draft",
        "valid",
        "rendered",
        "verified"
      ]
    },
    "verification": {
      "type": "object",
      "properties": {
        "at": {
          "type": "string",
          "pattern": "^\\d{4}-\\d{2}-\\d{2}(T[0-9:.]+Z?)?$",
          "description": "When a human last approved this scenario (ISO date or date-time)."
        },
        "primitivesHash": {
          "type": "string",
          "pattern": "^sha256:[0-9a-f]{16}$",
          "description": "Hash of expected.primitives.json at approval time. Absent for invalid-by-design scenarios, which have no primitives."
        },
        "renderHash": {
          "type": "string",
          "pattern": "^sha256:[0-9a-f]{16}$",
          "description": "Hash of the standalone SVG goldens (expected.svg + expected.tab.svg \u2014 this file set is frozen; expected.both.svg hashes separately as bothHash) at approval time \u2014 the emitter's own output, which primitivesHash cannot see. Optional: approvals predating the SVG golden carry no renderHash and are NOT treated as stale for lacking one; run --backfill-render to stamp them."
        },
        "bothHash": {
          "type": "string",
          "pattern": "^sha256:[0-9a-f]{16}$",
          "description": "Hash of expected.both.svg (the combined notation+tab system) at approval time. Optional: approvals predating the both golden carry no bothHash and are NOT stale for lacking one. There is no backfill \u2014 the combined system earns its hash only through a real approval."
        },
        "performanceHash": {
          "type": "string",
          "pattern": "^sha256:[0-9a-f]{16}$",
          "description": "Hash of presented performance tables and MIDI verdict; never grandfathered from engraving approval."
        },
        "performanceAt": {
          "type": "string",
          "description": "Date of performance evidence approval, independent of engraving approval."
        },
        "unrolledHash": {
          "type": "string",
          "pattern": "^sha256:[0-9a-f]{16}$",
          "description": "Hash of explicitly presented unrolled engravings; never grandfathered from written engraving approval."
        },
        "unrolledAt": {
          "type": "string",
          "description": "Date of unrolled evidence approval, independent of written and performance approvals."
        }
      },
      "required": [
        "at"
      ],
      "additionalProperties": false,
      "description": "Provenance of the last human approval, written only by verify-scenarios.mjs and deliberately KEPT through demotion \u2014 so the approval queue can distinguish 'stale' (verified once, a golden changed since: a hash differs or status was demoted) from 'never seen' (no record). See roadmap/complete/lab-structure-lab.md."
    },
    "performance": {
      "type": "boolean",
      "description": "Opt in to rational performance and bounded MIDI evidence. New evidence requires separate human approval."
    },
    "unrolled": {
      "type": "boolean",
      "description": "Opt in to performed-order SVG evidence; requires separate human approval."
    }
  },
  "required": [
    "title",
    "description",
    "expect",
    "source",
    "status"
  ],
  "additionalProperties": false
}
