{
  "title": "Beams (across barlines)",
  "description": "MNX spec example \"beams-across-barlines\".",
  "tags": [
    "spec-example"
  ],
  "specRefs": [
    "https://w3c-cg.github.io/mnx/docs/mnx-reference/examples/beams-across-barlines/"
  ],
  "coversDefs": [
    "beam",
    "clef",
    "clef-sign",
    "event",
    "global",
    "id",
    "measure-global",
    "mnx",
    "note",
    "note-value",
    "note-value-base",
    "octave",
    "part",
    "part-measure",
    "pitch",
    "positioned-clef",
    "positive-integer",
    "rest",
    "root",
    "sequence",
    "staff-position",
    "step",
    "time",
    "time-signature-unit",
    "version-number"
  ],
  "expect": {
    "standard": "valid",
    "extension": "n/a"
  },
  "requires": [],
  "source": "spec-example",
  "origin": "mirrored",
  "status": "rendered",
  "verification": {
    "at": "2026-07-17",
    "primitivesHash": "sha256:68e8a574f028a199"
  }
}
