{
  "title": "Capo re-origins the fret numbers",
  "description": "Capo 2 on declared standard strings; four bare quarters sound F#2 B2 E3 A3 — each exactly an effective open string (open + 2 semitones), so every derived fret is 0 on strings 6 5 4 3. Proves both capo jobs at once: the open pitches shift up, and printed frets are counted from the capo.",
  "bars": 1,
  "tags": [
    "tab",
    "tab:derivation",
    "derivation",
    "capo",
    "defaults"
  ],
  "specRefs": [
    "https://w3c-cg.github.io/mnx/docs/mnx-reference/objects/note/"
  ],
  "coversDefs": [
    "event",
    "note",
    "notes",
    "pitch",
    "vendor-extensions"
  ],
  "expect": {
    "standard": "valid",
    "extension": "valid"
  },
  "requires": [
    "tab-derivation"
  ],
  "idRefs": false,
  "source": "hand-written",
  "origin": "local",
  "status": "verified",
  "verification": {
    "at": "2026-08-07",
    "primitivesHash": "sha256:7f82f2f1fac74b22",
    "renderHash": "sha256:ba831ce094aafac8"
  }
}
