{
  "title": "Three-note chord and half rest",
  "description": "MNX spec example \"three-note-chord-and-half-rest\".",
  "tags": [
    "spec-example"
  ],
  "specRefs": [
    "https://w3c-cg.github.io/mnx/docs/mnx-reference/examples/three-note-chord-and-half-rest/"
  ],
  "coversDefs": [
    "barline",
    "barline-type",
    "clef",
    "clef-sign",
    "event",
    "global",
    "measure-global",
    "mnx",
    "note",
    "note-value",
    "note-value-base",
    "octave",
    "part",
    "part-measure",
    "pitch",
    "positioned-clef",
    "positive-integer",
    "root",
    "sequence",
    "staff-position",
    "step",
    "time",
    "time-signature-unit",
    "version-number"
  ],
  "expect": {
    "standard": "valid",
    "extension": "n/a"
  },
  "requires": [],
  "source": "spec-example",
  "status": "rendered"
}
