{
  "title": "Stacked directions",
  "description": "Directions sharing a position and an orientation are displayed stacked outward from the staff, in the order they appear in the array — the first is nearest the notes. That ordering is all a renderer needs to place several instructions at one point. No direction says how far from the staff it belongs, and none needs to. Proposed MNX objects, not yet adopted — see roadmap/proposed/low-priority/spec-score-text.md.",
  "bars": 1,
  "tags": [
    "directions",
    "stacking",
    "proposed"
  ],
  "specRefs": [
    "https://github.com/w3c-cg/mnx/issues/112"
  ],
  "coversDefs": [
    "clef",
    "clef-sign",
    "direction",
    "direction-list",
    "event",
    "fraction",
    "global",
    "integer-unsigned",
    "measure-global",
    "mnx",
    "multi-staff-orientation",
    "note",
    "note-value",
    "note-value-base",
    "octave",
    "part",
    "part-measure",
    "pitch",
    "positioned-clef",
    "positive-integer",
    "rhythmic-position",
    "root",
    "sequence",
    "staff-position",
    "step",
    "string",
    "time",
    "time-signature-unit",
    "version-number"
  ],
  "schema": "proposed",
  "proposal": "score-text",
  "expect": {
    "standard": "valid",
    "extension": "n/a"
  },
  "requires": [],
  "idRefs": false,
  "source": "hand-written",
  "origin": "local",
  "status": "rendered",
  "verification": {
    "at": "2026-08-07",
    "primitivesHash": "sha256:dd2fadd5c971fbb7",
    "renderHash": "sha256:066b7b4f5493eacf"
  }
}
