{
  "title": "Tuplets",
  "description": "MNX spec example \"tuplets\".",
  "tags": [
    "spec-example"
  ],
  "specRefs": [
    "https://w3c-cg.github.io/mnx/docs/mnx-reference/examples/tuplets/"
  ],
  "coversDefs": [
    "beam",
    "clef",
    "clef-sign",
    "event",
    "global",
    "id",
    "literal-string-tuplet",
    "measure-global",
    "mnx",
    "note",
    "note-value",
    "note-value-base",
    "note-value-quantity",
    "octave",
    "part",
    "part-measure",
    "pitch",
    "positioned-clef",
    "positive-integer",
    "root",
    "sequence",
    "staff-position",
    "step",
    "time",
    "time-signature-unit",
    "tuplet",
    "version-number"
  ],
  "expect": {
    "standard": "valid",
    "extension": "n/a"
  },
  "requires": [],
  "source": "spec-example",
  "origin": "mirrored",
  "status": "rendered",
  "verification": {
    "at": "2026-08-14",
    "primitivesHash": "sha256:e7fbd45b98e4f7fa",
    "renderHash": "sha256:c73bc28f989eb66a"
  },
  "performance": true
}
