{
  "title": "Grace note",
  "description": "MNX spec example \"grace-note\".",
  "tags": [
    "spec-example"
  ],
  "specRefs": [
    "https://w3c-cg.github.io/mnx/docs/mnx-reference/examples/grace-note/"
  ],
  "coversDefs": [
    "clef",
    "clef-sign",
    "event",
    "global",
    "grace",
    "literal-string-grace",
    "measure-global",
    "mnx",
    "note",
    "note-value",
    "note-value-base",
    "octave",
    "part",
    "part-measure",
    "pitch",
    "positioned-clef",
    "positive-integer",
    "root",
    "sequence",
    "staff-position",
    "step",
    "time",
    "time-signature-unit",
    "version-number"
  ],
  "expect": {
    "standard": "valid",
    "extension": "n/a"
  },
  "requires": [],
  "source": "spec-example",
  "origin": "mirrored",
  "status": "rendered",
  "verification": {
    "at": "2026-08-14",
    "primitivesHash": "sha256:6a5d7b631f4cadd5",
    "renderHash": "sha256:b0aaf50bab091558"
  },
  "performance": true
}
