{
  "title": "Dynamic accents",
  "description": "In accent dynamics, such as sf or fz, an MNX document encodes the accent metadata (the \"s\" prefix of \"sf\", or the \"z\" suffix of \"fz\") structurally.\n\nThe \"accentPrefix\", \"value\", \"accentSuffix\" and \"residualValue\" concatenate to the conventional abbreviation, so \"s\" + \"f\" + \"z\" results in \"sfz\" and \"r\" + \"f\" + \"z\" results in \"rfz\".\n\nNote: if not explicitly encoded, \"accentPrefix\" defaults to \"s\" and \"accentSuffix\" defaults to \"z\", meaning the common case (sfz) can be encoded as {\"type\": \"accent\", \"value\": \"f\"}. To encode a dynamic without that prefix or suffix, use an empty string: {\"type\": \"accent\": \"accentPrefix\": \"\", \"value\": \"f\"} encodes fz.\n\nThe second measure here demonstrates \"residualValue\", which is the dynamic that applies after the initial attack.",
  "tags": [
    "spec-example"
  ],
  "specRefs": [
    "https://w3c-cg.github.io/mnx/docs/mnx-reference/examples/dynamic-accents/"
  ],
  "coversDefs": [
    "clef",
    "clef-sign",
    "dynamic-group",
    "dynamic-group-type",
    "dynamic-prefix",
    "dynamic-suffix",
    "dynamic-value",
    "event",
    "global",
    "integer-unsigned",
    "measure-global",
    "mnx",
    "note",
    "note-value",
    "note-value-base",
    "octave",
    "part",
    "part-measure",
    "pitch",
    "positioned-clef",
    "positive-integer",
    "rhythmic-position",
    "root",
    "sequence",
    "staff-position",
    "step",
    "time",
    "time-signature-unit",
    "version-number"
  ],
  "expect": {
    "standard": "valid",
    "extension": "n/a"
  },
  "requires": [],
  "source": "spec-example",
  "origin": "mirrored",
  "status": "rendered",
  "verification": {
    "at": "2026-08-07",
    "primitivesHash": "sha256:a122dd763775d4d9",
    "renderHash": "sha256:fed5f098a3aa409b"
  },
  "performance": true
}
